ticket_id,created_at,resolved_at,channel,agent_id,category,priority,status,subject,body,resolution_note,word_count,product,company,language,region,severity,tags,root_cause,knowledge_article,customer_satisfaction,conversation
TK-000605,2026-04-11 03:06:09,2026-04-13 11:06:09,chat,AGT-010,shipping,low,resolved,Missing item from multi-item order,My order #82143 was supposed to arrive 6 days ago but I still haven't received it. Tracking: TK-971341.,Investigated: address was cached from previous order. Refund issued; reshipment to correct address.,18,CRM System,Dell,English,UAE,Major,shipping,Courier delay,"Track shipment, contact courier, arrange replacement if necessary.",5.0,"Customer: My order #82143 was supposed to arrive 6 days ago but I still haven't received it. Tracking: TK-971341.
Support: Investigated: address was cached from previous order. Refund issued; reshipment to correct address."
TK-000624,2026-05-12 11:38:22,2026-05-13 12:38:22,web_form,AGT-019,billing,medium,resolved,Refund not received after 30 days,My account shows two identical charges of $427.78 on the same date. I need a refund for the duplicate.,Verified the charge discrepancy. Issued a credit of $294.35 to the account. Customer notified.,19,Desktop Client,Oracle,English,UK,Minor,billing,Incorrect billing configuration,"Verify invoice, compare billing history, process refund if needed.",4.0,"Customer: My account shows two identical charges of $427.78 on the same date. I need a refund for the duplicate.
Support: Verified the charge discrepancy. Issued a credit of $294.35 to the account. Customer notified."
TK-000382,2026-06-21 15:05:13,2026-06-21 20:05:13,email,AGT-005,technical,high,closed,Application crashes on startup,Uploads above 68MB fail with a timeout error. We regularly upload large datasets.,OTP delivery issue traced to SMS provider outage. Switched to backup provider. OTP now working.,13,Web Platform,Cisco,English,USA,Minor,technical,Software bug or infrastructure issue,"Restart service, collect logs, investigate server health, deploy hotfix if required.",4.0,"Customer: Uploads above 68MB fail with a timeout error. We regularly upload large datasets.
Support: OTP delivery issue traced to SMS provider outage. Switched to backup provider. OTP now working."
TK-000008,2026-06-06 00:40:10,,phone_callback,AGT-020,billing,medium,open,Double billing issue,I was charged $204.25 on 2026-05-26 but this does not match my plan. My account email is mezajared@example.org. Please review and correct.,,22,Payment API,Cisco,English,Saudi Arabia,Minor,billing,Incorrect billing configuration,"Verify invoice, compare billing history, process refund if needed.",,"Customer: I was charged $204.25 on 2026-05-26 but this does not match my plan. My account email is mezajared@example.org. Please review and correct.
Support: Issue is under investigation."
TK-000921,2026-04-14 14:07:05,,email,AGT-016,shipping,high,in_progress,Return shipment not picked up,My package arrived with significant damage. Contents are broken. Order #41301. Photos attached.,,13,Web Platform,Google,English,UK,Major,shipping,Courier delay,"Track shipment, contact courier, arrange replacement if necessary.",,"Customer: My package arrived with significant damage. Contents are broken. Order #41301. Photos attached.
Support: Issue is under investigation."
TK-000258,2026-06-09 21:45:14,,chat,AGT-010,technical,high,open,Login page returns 500 error,"Since the v1.2.3 update, our Zapier integration no longer syncs data. Last successful sync: 2026-05-19.",,15,CRM System,Cisco,Arabic,Egypt,Critical,technical,Software bug or infrastructure issue,"Restart service, collect logs, investigate server health, deploy hotfix if required.",,"Customer: Since the v1.2.3 update, our Zapier integration no longer syncs data. Last successful sync: 2026-05-19.
Support: Issue is under investigation."
TK-000262,2026-04-05 00:01:58,2026-04-07 04:01:58,social_media,AGT-019,general,low,resolved,Accessibility features available?,We need to confirm the platform meets WCAG 2.1 AA accessibility standards before purchasing.,Shared SLA document outlining support hours and response time commitments by plan tier.,14,Mobile App,Microsoft,English,UK,Major,general,Customer information request,Answer customer inquiry using the official knowledge base.,3.0,"Customer: We need to confirm the platform meets WCAG 2.1 AA accessibility standards before purchasing.
Support: Shared SLA document outlining support hours and response time commitments by plan tier."
TK-000979,2026-03-09 09:38:20,,social_media,AGT-006,technical,high,in_progress,Data export feature not working,I get a 500 Internal Server Error when trying to log in. This started 11 days ago. Browser: Safari 17.,,20,Payment API,Intel,Arabic,UK,Critical,technical,Software bug or infrastructure issue,"Restart service, collect logs, investigate server health, deploy hotfix if required.",,"Customer: I get a 500 Internal Server Error when trying to log in. This started 11 days ago. Browser: Safari 17.
Support: Issue is under investigation."
TK-000873,2026-04-09 04:47:20,2026-04-10 18:47:20,email,AGT-007,billing,low,resolved,Billing address update not reflected,I updated my billing address last week but my latest invoice still shows the old address.,Located the refund request. Escalated to finance team. ETA updated and customer informed.,16,Cloud Dashboard,Microsoft,English,USA,Minor,billing,Incorrect billing configuration,"Verify invoice, compare billing history, process refund if needed.",5.0,"Customer: I updated my billing address last week but my latest invoice still shows the old address.
Support: Located the refund request. Escalated to finance team. ETA updated and customer informed."
TK-000203,2026-06-25 15:08:51,2026-06-26 07:08:51,web_form,AGT-012,product,low,resolved,Compatibility question about Stripe,I'm trying to decide between Basic and Teams. What are the key differences for a team of 4670 people?,Confirmed audit logs is on the mobile roadmap for Q3. Customer added to beta list.,19,CRM System,Oracle,English,Germany,Critical,product,Missing documentation,Provide product documentation and user guide.,3.0,"Customer: I'm trying to decide between Basic and Teams. What are the key differences for a team of 4670 people?
Support: Confirmed audit logs is on the mobile roadmap for Q3. Customer added to beta list."
TK-000903,2026-03-28 21:18:32,2026-03-30 11:18:32,social_media,AGT-006,general,medium,resolved,General inquiry about your service,What are your customer support hours and response time commitments?,Sent DPA and GDPR compliance documentation. Offered to connect with our DPO.,10,Web Platform,IBM,Arabic,UAE,Critical,general,Customer information request,Answer customer inquiry using the official knowledge base.,5.0,"Customer: What are your customer support hours and response time commitments?
Support: Sent DPA and GDPR compliance documentation. Offered to connect with our DPO."
TK-000992,2026-06-12 16:00:55,2026-06-13 07:00:55,chat,AGT-005,billing,medium,resolved,Double billing issue,I was charged $91.36 on 2026-05-21 but this does not match my plan. My account email is jonesmarie@example.org. Please review and correct.,Updated invoice to reflect correct pricing. Sent amended invoice to customer.,22,Mobile App,Intel,Arabic,UK,Minor,billing,Incorrect billing configuration,"Verify invoice, compare billing history, process refund if needed.",3.0,"Customer: I was charged $91.36 on 2026-05-21 but this does not match my plan. My account email is jonesmarie@example.org. Please review and correct.
Support: Updated invoice to reflect correct pricing. Sent amended invoice to customer."
TK-000508,2026-05-10 06:40:49,2026-05-11 02:40:49,email,AGT-005,account,medium,resolved,Cannot delete my account,I want to close my account permanently but the delete option is greyed out in settings.,Ownership transfer process completed after verification of both parties.,16,CRM System,Google,Arabic,UK,Major,account,Authentication failure,"Verify customer identity, reset credentials, unlock account.",3.0,"Customer: I want to close my account permanently but the delete option is greyed out in settings.
Support: Ownership transfer process completed after verification of both parties."
TK-000642,2026-02-07 07:08:00,2026-02-09 10:08:00,chat,AGT-018,shipping,high,resolved,Missing item from multi-item order,My package arrived with significant damage. Contents are broken. Order #91387. Photos attached.,Investigated with carrier. Package was delayed at regional hub. Expedited delivery – arrived next day.,13,CRM System,Cisco,Arabic,USA,Minor,shipping,Courier delay,"Track shipment, contact courier, arrange replacement if necessary.",3.0,"Customer: My package arrived with significant damage. Contents are broken. Order #91387. Photos attached.
Support: Investigated with carrier. Package was delayed at regional hub. Expedited delivery – arrived next day."
TK-000856,2026-03-07 06:30:31,2026-03-08 19:30:31,email,AGT-007,general,medium,resolved,Request for enterprise pricing,I came across your service online and want to know more about what you offer before signing up.,Escalated to enterprise sales team. Custom proposal sent within 24 hours.,18,Web Platform,Google,Arabic,UK,Minor,general,Customer information request,Answer customer inquiry using the official knowledge base.,4.0,"Customer: I came across your service online and want to know more about what you offer before signing up.
Support: Escalated to enterprise sales team. Custom proposal sent within 24 hours."
TK-000091,2026-02-17 10:14:49,,web_form,AGT-006,billing,high,escalated,Unexpected subscription renewal charge,I updated my billing address last week but my latest invoice still shows the old address.,,16,Cloud Dashboard,Cisco,Arabic,UK,Major,billing,Incorrect billing configuration,"Verify invoice, compare billing history, process refund if needed.",,"Customer: I updated my billing address last week but my latest invoice still shows the old address.
Support: Issue is under investigation."
TK-000071,2026-03-24 09:59:59,2026-03-24 11:59:59,phone_callback,AGT-002,technical,high,closed,File upload fails for files over 48MB,Our API key is hitting rate limits even though we are well within the documented quota. Account ID: 47616.,Increased upload size limit for account plan. Customer confirmed large files uploading correctly.,19,CRM System,IBM,Arabic,UK,Major,technical,Software bug or infrastructure issue,"Restart service, collect logs, investigate server health, deploy hotfix if required.",4.0,"Customer: Our API key is hitting rate limits even though we are well within the documented quota. Account ID: 47616.
Support: Increased upload size limit for account plan. Customer confirmed large files uploading correctly."
TK-000771,2026-04-11 05:07:18,2026-04-14 03:07:18,social_media,AGT-019,shipping,high,resolved,Missing item from multi-item order,My package arrived with significant damage. Contents are broken. Order #50955. Photos attached.,Tracking system glitch identified. Actual package in transit. Customer updated with real ETA.,13,Payment API,Dell,Arabic,UAE,Major,shipping,Courier delay,"Track shipment, contact courier, arrange replacement if necessary.",4.0,"Customer: My package arrived with significant damage. Contents are broken. Order #50955. Photos attached.
Support: Tracking system glitch identified. Actual package in transit. Customer updated with real ETA."
TK-000661,2026-01-09 10:01:10,2026-01-09 22:01:10,web_form,AGT-013,shipping,medium,resolved,Tracking number not updating,My order #96889 was supposed to arrive 28 days ago but I still haven't received it. Tracking: TK-784371.,Wrong item confirmed. Correct item reshipped with priority delivery. Return label sent for wrong item.,18,CRM System,Dell,Arabic,Germany,Critical,shipping,Courier delay,"Track shipment, contact courier, arrange replacement if necessary.",3.0,"Customer: My order #96889 was supposed to arrive 28 days ago but I still haven't received it. Tracking: TK-784371.
Support: Wrong item confirmed. Correct item reshipped with priority delivery. Return label sent for wrong item."
TK-000424,2026-02-01 00:09:11,,chat,AGT-010,shipping,high,open,Tracking number not updating,My order #38521 should have contained 3 items but only 2 arrived. Missing: Business-focused fresh-thinking extranet.,,16,CRM System,Cisco,Arabic,Saudi Arabia,Major,shipping,Courier delay,"Track shipment, contact courier, arrange replacement if necessary.",,"Customer: My order #38521 should have contained 3 items but only 2 arrived. Missing: Business-focused fresh-thinking extranet.
Support: Issue is under investigation."
TK-000404,2026-05-12 14:36:31,2026-05-13 10:36:31,web_form,AGT-009,general,low,resolved,Looking for a partner/reseller program,"Can you share a case study for a company similar to ours, or arrange a product demo?",Scheduled 30-minute demo. Sent relevant case study PDF post-call.,17,Desktop Client,IBM,English,Germany,Major,general,Customer information request,Answer customer inquiry using the official knowledge base.,3.0,"Customer: Can you share a case study for a company similar to ours, or arrange a product demo?
Support: Scheduled 30-minute demo. Sent relevant case study PDF post-call."
TK-000689,2026-04-10 19:32:02,,web_form,AGT-006,technical,high,open,Two-factor authentication not sending OTP,"Since the v2.8.0 update, our Zapier integration no longer syncs data. Last successful sync: 2026-06-01.",,15,Payment API,IBM,Arabic,Saudi Arabia,Critical,technical,Software bug or infrastructure issue,"Restart service, collect logs, investigate server health, deploy hotfix if required.",,"Customer: Since the v2.8.0 update, our Zapier integration no longer syncs data. Last successful sync: 2026-06-01.
Support: Issue is under investigation."
TK-000904,2026-04-13 18:58:56,2026-04-16 03:58:56,web_form,AGT-002,shipping,low,resolved,Received wrong item in my order,My order #37517 was supposed to arrive 27 days ago but I still haven't received it. Tracking: TK-856905.,Damage claim filed with carrier. Replacement order created and shipped. Photo evidence retained.,18,Web Platform,IBM,English,UAE,Minor,shipping,Courier delay,"Track shipment, contact courier, arrange replacement if necessary.",4.0,"Customer: My order #37517 was supposed to arrive 27 days ago but I still haven't received it. Tracking: TK-856905.
Support: Damage claim filed with carrier. Replacement order created and shipped. Photo evidence retained."
TK-000139,2026-02-26 05:15:58,,web_form,AGT-003,product,high,in_progress,Is SSO login available on the mobile app?,It would be great if you could add custom reports to the product. This would save our team a lot of time.,,22,Cloud Dashboard,Amazon,Arabic,USA,Major,product,Missing documentation,Provide product documentation and user guide.,,"Customer: It would be great if you could add custom reports to the product. This would save our team a lot of time.
Support: Issue is under investigation."
TK-000493,2026-04-29 00:25:45,2026-04-29 22:25:45,chat,AGT-007,account,high,resolved,Cannot reset my password,I sent a team invite to morgan54@example.org 17 days ago but they say they never received it.,Ownership transfer process completed after verification of both parties.,17,Web Platform,Cisco,Arabic,USA,Minor,account,Authentication failure,"Verify customer identity, reset credentials, unlock account.",3.0,"Customer: I sent a team invite to morgan54@example.org 17 days ago but they say they never received it.
Support: Ownership transfer process completed after verification of both parties."
TK-000820,2026-01-24 19:34:36,2026-01-25 22:34:36,web_form,AGT-017,shipping,medium,closed,Return shipment not picked up,I scheduled a return pickup 22 days ago but the courier never showed up.,Tracking system glitch identified. Actual package in transit. Customer updated with real ETA.,14,Web Platform,IBM,Arabic,UK,Minor,shipping,Courier delay,"Track shipment, contact courier, arrange replacement if necessary.",5.0,"Customer: I scheduled a return pickup 22 days ago but the courier never showed up.
Support: Tracking system glitch identified. Actual package in transit. Customer updated with real ETA."
TK-000470,2026-03-28 22:10:54,2026-03-31 00:10:54,social_media,AGT-005,billing,high,resolved,Refund not received after 15 days,I upgraded my plan but the old price is still showing on invoice #91365. The new rate should be $48.11/month.,Updated invoice to reflect correct pricing. Sent amended invoice to customer.,20,Cloud Dashboard,Oracle,English,UK,Major,billing,Incorrect billing configuration,"Verify invoice, compare billing history, process refund if needed.",3.0,"Customer: I upgraded my plan but the old price is still showing on invoice #91365. The new rate should be $48.11/month.
Support: Updated invoice to reflect correct pricing. Sent amended invoice to customer."
TK-000056,2026-06-20 23:39:35,2026-06-23 16:39:35,email,AGT-008,shipping,medium,resolved,Order shipped to wrong address,I scheduled a return pickup 7 days ago but the courier never showed up.,Tracking system glitch identified. Actual package in transit. Customer updated with real ETA.,14,Mobile App,Amazon,Arabic,UK,Minor,shipping,Courier delay,"Track shipment, contact courier, arrange replacement if necessary.",4.0,"Customer: I scheduled a return pickup 7 days ago but the courier never showed up.
Support: Tracking system glitch identified. Actual package in transit. Customer updated with real ETA."
TK-000389,2026-05-08 07:50:45,2026-05-09 21:50:45,chat,AGT-002,general,low,closed,Looking for a case study or demo,We are interested in reselling your product. Do you have a partner programme?,Shared SLA document outlining support hours and response time commitments by plan tier.,13,Mobile App,Microsoft,English,Germany,Critical,general,Customer information request,Answer customer inquiry using the official knowledge base.,3.0,"Customer: We are interested in reselling your product. Do you have a partner programme?
Support: Shared SLA document outlining support hours and response time commitments by plan tier."
TK-000226,2026-03-27 05:29:33,2026-03-29 03:29:33,web_form,AGT-005,shipping,high,resolved,Missing item from multi-item order,My order #24634 should have contained 5 items but only 1 arrived. Missing: Advanced methodical core.,Missing item located in warehouse. Shipped separately with tracking. Customer confirmed receipt.,16,Desktop Client,Intel,Arabic,Egypt,Minor,shipping,Courier delay,"Track shipment, contact courier, arrange replacement if necessary.",5.0,"Customer: My order #24634 should have contained 5 items but only 1 arrived. Missing: Advanced methodical core.
Support: Missing item located in warehouse. Shipped separately with tracking. Customer confirmed receipt."
TK-000128,2026-01-23 18:17:43,,phone_callback,AGT-008,general,medium,open,How do I get started?,I came across your service online and want to know more about what you offer before signing up.,,18,Cloud Dashboard,Cisco,English,UAE,Critical,general,Customer information request,Answer customer inquiry using the official knowledge base.,,"Customer: I came across your service online and want to know more about what you offer before signing up.
Support: Issue is under investigation."
TK-000429,2026-01-11 04:59:31,2026-01-12 21:59:31,phone_callback,AGT-010,product,low,resolved,How do I use SSO login?,The docs for API webhooks are outdated – the screenshots don't match the current UI.,Enhancement suggestion logged for next sprint review. Customer thanked for feedback.,15,Payment API,Dell,Arabic,UAE,Critical,product,Missing documentation,Provide product documentation and user guide.,4.0,"Customer: The docs for API webhooks are outdated – the screenshots don't match the current UI.
Support: Enhancement suggestion logged for next sprint review. Customer thanked for feedback."
TK-000560,2026-05-15 18:27:03,2026-05-17 09:27:03,phone_callback,AGT-015,technical,high,resolved,Data export feature not working,The dashboard takes over 114 seconds to load. This is affecting our team's productivity.,Increased upload size limit for account plan. Customer confirmed large files uploading correctly.,14,Cloud Dashboard,Dell,Arabic,Egypt,Critical,technical,Software bug or infrastructure issue,"Restart service, collect logs, investigate server health, deploy hotfix if required.",3.0,"Customer: The dashboard takes over 114 seconds to load. This is affecting our team's productivity.
Support: Increased upload size limit for account plan. Customer confirmed large files uploading correctly."
TK-000635,2026-01-11 05:27:56,2026-01-13 05:27:56,email,AGT-003,technical,high,resolved,Two-factor authentication not sending OTP,Trying to export data as CSV returns a blank file. Happens for date ranges over 6 days.,Root cause: database connection pool exhaustion. Increased pool size. Monitored for 1 hour – stable.,17,Web Platform,Intel,Arabic,Germany,Critical,technical,Software bug or infrastructure issue,"Restart service, collect logs, investigate server health, deploy hotfix if required.",5.0,"Customer: Trying to export data as CSV returns a blank file. Happens for date ranges over 6 days.
Support: Root cause: database connection pool exhaustion. Increased pool size. Monitored for 1 hour – stable."
TK-000190,2026-01-15 08:26:33,,social_media,AGT-005,account,low,open,Account locked after too many login attempts,I want to close my account permanently but the delete option is greyed out in settings.,,16,Payment API,Microsoft,Arabic,USA,Major,account,Authentication failure,"Verify customer identity, reset credentials, unlock account.",,"Customer: I want to close my account permanently but the delete option is greyed out in settings.
Support: Issue is under investigation."
TK-000944,2026-04-30 20:12:07,2026-05-01 06:12:07,chat,AGT-003,product,low,closed,Product documentation is unclear for mobile notifications,I'm trying to decide between Pro and Enterprise. What are the key differences for a team of 16810 people?,Provided detailed plan comparison table. Customer decided to proceed with the higher tier.,19,Web Platform,Google,English,Germany,Critical,product,Missing documentation,Provide product documentation and user guide.,3.0,"Customer: I'm trying to decide between Pro and Enterprise. What are the key differences for a team of 16810 people?
Support: Provided detailed plan comparison table. Customer decided to proceed with the higher tier."
TK-000006,2026-02-15 01:46:23,2026-02-17 02:46:23,chat,AGT-005,shipping,low,resolved,Received wrong item in my order,My package arrived with significant damage. Contents are broken. Order #58377. Photos attached.,Wrong item confirmed. Correct item reshipped with priority delivery. Return label sent for wrong item.,13,Cloud Dashboard,Intel,Arabic,Saudi Arabia,Minor,shipping,Courier delay,"Track shipment, contact courier, arrange replacement if necessary.",4.0,"Customer: My package arrived with significant damage. Contents are broken. Order #58377. Photos attached.
Support: Wrong item confirmed. Correct item reshipped with priority delivery. Return label sent for wrong item."
TK-000785,2026-01-07 17:02:01,2026-01-09 14:02:01,web_form,AGT-019,technical,medium,resolved,Data export feature not working,The app crashes every time I open it since the update on 2026-05-02. I am on macOS 14 version 2.6.8. Error log: ERR-qiCZ-5672.,Found misconfiguration in rate-limit tier for this account. Corrected and documented.,23,Payment API,Intel,English,UAE,Critical,technical,Software bug or infrastructure issue,"Restart service, collect logs, investigate server health, deploy hotfix if required.",4.0,"Customer: The app crashes every time I open it since the update on 2026-05-02. I am on macOS 14 version 2.6.8. Error log: ERR-qiCZ-5672.
Support: Found misconfiguration in rate-limit tier for this account. Corrected and documented."
TK-000883,2026-04-17 13:46:32,2026-04-20 13:46:32,email,AGT-014,billing,low,resolved,Double billing issue,I was charged $318.44 on 2026-05-28 but this does not match my plan. My account email is saraharmstrong@example.net. Please review and correct.,Confirmed duplicate charge. Refund of $340.77 initiated and will reflect in 3–5 business days.,22,Cloud Dashboard,Amazon,Arabic,Egypt,Critical,billing,Incorrect billing configuration,"Verify invoice, compare billing history, process refund if needed.",3.0,"Customer: I was charged $318.44 on 2026-05-28 but this does not match my plan. My account email is saraharmstrong@example.net. Please review and correct.
Support: Confirmed duplicate charge. Refund of $340.77 initiated and will reflect in 3–5 business days."
TK-000392,2026-03-14 11:21:01,2026-03-16 21:21:01,chat,AGT-009,shipping,medium,resolved,Package arrived damaged,I received a completely wrong item. I ordered Cross-platform incremental software but received something else entirely. Order #1673.,Investigated: address was cached from previous order. Refund issued; reshipment to correct address.,18,CRM System,Amazon,Arabic,Egypt,Critical,shipping,Courier delay,"Track shipment, contact courier, arrange replacement if necessary.",3.0,"Customer: I received a completely wrong item. I ordered Cross-platform incremental software but received something else entirely. Order #1673.
Support: Investigated: address was cached from previous order. Refund issued; reshipment to correct address."
TK-000100,2026-03-18 19:54:43,,chat,AGT-013,product,medium,in_progress,How do I use bulk export?,I can't figure out how to use audit logs. The documentation doesn't explain the steps clearly.,,16,Cloud Dashboard,Cisco,Arabic,Saudi Arabia,Critical,product,Missing documentation,Provide product documentation and user guide.,,"Customer: I can't figure out how to use audit logs. The documentation doesn't explain the steps clearly.
Support: Issue is under investigation."
