ticket_id,created_at,resolved_at,channel,agent_id,category,priority,status,subject,body,resolution_note,word_count,product,company,language,region,severity,tags,root_cause,knowledge_article,customer_satisfaction,conversation
TK-000132,2026-01-27 03:31:03,2026-01-27 23:31:03,phone_callback,AGT-012,billing,high,resolved,Unexpected subscription renewal charge,I cancelled my subscription on 2026-05-29 but was still charged $31.86 for the next cycle.,Verified the charge discrepancy. Issued a credit of $278.72 to the account. Customer notified.,15,Web Platform,Amazon,English,Saudi Arabia,Major,billing,Incorrect billing configuration,"Verify invoice, compare billing history, process refund if needed.",3.0,"Customer: I cancelled my subscription on 2026-05-29 but was still charged $31.86 for the next cycle.
Support: Verified the charge discrepancy. Issued a credit of $278.72 to the account. Customer notified."
TK-000155,2026-05-28 01:08:48,,social_media,AGT-013,billing,low,escalated,Cannot access invoice #16366,My account shows two identical charges of $48.7 on the same date. I need a refund for the duplicate.,,19,CRM System,Intel,English,Germany,Major,billing,Incorrect billing configuration,"Verify invoice, compare billing history, process refund if needed.",,"Customer: My account shows two identical charges of $48.7 on the same date. I need a refund for the duplicate.
Support: Issue is under investigation."
TK-000423,2026-04-28 15:29:12,,phone_callback,AGT-003,technical,high,in_progress,Application crashes on startup,I get a 500 Internal Server Error when trying to log in. This started 20 days ago. Browser: Edge 122.,,20,Desktop Client,Oracle,Arabic,UK,Critical,technical,Software bug or infrastructure issue,"Restart service, collect logs, investigate server health, deploy hotfix if required.",,"Customer: I get a 500 Internal Server Error when trying to log in. This started 20 days ago. Browser: Edge 122.
Support: Issue is under investigation."
TK-000673,2026-03-19 01:08:20,,web_form,AGT-001,general,medium,open,General inquiry about your service,We need to confirm the platform meets WCAG 2.1 AA accessibility standards before purchasing.,,14,Mobile App,Amazon,Arabic,UK,Minor,general,Customer information request,Answer customer inquiry using the official knowledge base.,,"Customer: We need to confirm the platform meets WCAG 2.1 AA accessibility standards before purchasing.
Support: Issue is under investigation."
TK-000339,2026-02-14 15:34:06,,phone_callback,AGT-004,account,low,in_progress,Cannot delete my account,The password reset email is not arriving at martinezwillie@example.org. I have checked spam. Please help me reset manually.,,18,Cloud Dashboard,Dell,Arabic,Egypt,Critical,account,Authentication failure,"Verify customer identity, reset credentials, unlock account.",,"Customer: The password reset email is not arriving at martinezwillie@example.org. I have checked spam. Please help me reset manually.
Support: Issue is under investigation."
TK-000581,2026-04-20 21:35:28,2026-04-22 21:35:28,phone_callback,AGT-001,technical,high,resolved,Dashboard loading very slowly,The dashboard takes over 25 seconds to load. This is affecting our team's productivity.,OTP delivery issue traced to SMS provider outage. Switched to backup provider. OTP now working.,14,CRM System,Oracle,English,UAE,Minor,technical,Software bug or infrastructure issue,"Restart service, collect logs, investigate server health, deploy hotfix if required.",4.0,"Customer: The dashboard takes over 25 seconds to load. This is affecting our team's productivity.
Support: OTP delivery issue traced to SMS provider outage. Switched to backup provider. OTP now working."
TK-000134,2026-01-25 05:22:31,2026-01-27 00:22:31,web_form,AGT-009,general,medium,closed,Accessibility features available?,What are your customer support hours and response time commitments?,Shared WCAG 2.1 AA compliance documentation. Offered accessibility audit report.,10,Web Platform,Cisco,English,UAE,Major,general,Customer information request,Answer customer inquiry using the official knowledge base.,5.0,"Customer: What are your customer support hours and response time commitments?
Support: Shared WCAG 2.1 AA compliance documentation. Offered accessibility audit report."
TK-000850,2026-04-25 04:17:12,2026-04-25 22:17:12,phone_callback,AGT-003,product,high,closed,Feature request: API webhooks,We want to integrate with Stripe. Can you confirm compatibility with your API v1.4.8?,Docs team notified. Updated documentation sent directly to customer.,14,CRM System,Google,Arabic,Saudi Arabia,Major,product,Missing documentation,Provide product documentation and user guide.,3.0,"Customer: We want to integrate with Stripe. Can you confirm compatibility with your API v1.4.8?
Support: Docs team notified. Updated documentation sent directly to customer."
TK-000042,2026-02-09 05:32:58,2026-02-09 17:32:58,web_form,AGT-015,billing,medium,resolved,Unexpected subscription renewal charge,I upgraded my plan but the old price is still showing on invoice #64646. The new rate should be $139.42/month.,Verified the charge discrepancy. Issued a credit of $375.41 to the account. Customer notified.,20,Cloud Dashboard,Microsoft,Arabic,Germany,Major,billing,Incorrect billing configuration,"Verify invoice, compare billing history, process refund if needed.",5.0,"Customer: I upgraded my plan but the old price is still showing on invoice #64646. The new rate should be $139.42/month.
Support: Verified the charge discrepancy. Issued a credit of $375.41 to the account. Customer notified."
TK-000724,2026-04-22 16:12:13,2026-04-23 09:12:13,web_form,AGT-008,shipping,medium,closed,Order #48728 not delivered after 20 days,I scheduled a return pickup 18 days ago but the courier never showed up.,Investigated with carrier. Package was delayed at regional hub. Expedited delivery – arrived next day.,14,Mobile App,Intel,Arabic,UK,Major,shipping,Courier delay,"Track shipment, contact courier, arrange replacement if necessary.",5.0,"Customer: I scheduled a return pickup 18 days ago but the courier never showed up.
Support: Investigated with carrier. Package was delayed at regional hub. Expedited delivery – arrived next day."
TK-000438,2026-01-11 12:30:59,2026-01-11 18:30:59,chat,AGT-001,product,medium,resolved,Is mobile notifications available on the mobile app?,I can't figure out how to use bulk export. The documentation doesn't explain the steps clearly.,Provided detailed plan comparison table. Customer decided to proceed with the higher tier.,16,CRM System,Dell,English,Saudi Arabia,Major,product,Missing documentation,Provide product documentation and user guide.,3.0,"Customer: I can't figure out how to use bulk export. The documentation doesn't explain the steps clearly.
Support: Provided detailed plan comparison table. Customer decided to proceed with the higher tier."
TK-000968,2026-01-23 07:51:52,,chat,AGT-020,general,medium,open,Accessibility features available?,We need to confirm the platform meets WCAG 2.1 AA accessibility standards before purchasing.,,14,Payment API,Microsoft,Arabic,Saudi Arabia,Major,general,Customer information request,Answer customer inquiry using the official knowledge base.,,"Customer: We need to confirm the platform meets WCAG 2.1 AA accessibility standards before purchasing.
Support: Issue is under investigation."
TK-000580,2026-01-27 14:25:48,2026-01-30 06:25:48,email,AGT-015,product,low,resolved,Is custom reports available on the mobile app?,I can't figure out how to use audit logs. The documentation doesn't explain the steps clearly.,Confirmed compatibility. Shared integration guide and API credentials needed.,16,Cloud Dashboard,Cisco,English,UK,Critical,product,Missing documentation,Provide product documentation and user guide.,3.0,"Customer: I can't figure out how to use audit logs. The documentation doesn't explain the steps clearly.
Support: Confirmed compatibility. Shared integration guide and API credentials needed."
TK-000367,2026-05-24 16:54:26,2026-05-26 06:54:26,social_media,AGT-003,technical,medium,resolved,API rate limit exceeded unexpectedly,"Since the v3.2.2 update, our Zapier integration no longer syncs data. Last successful sync: 2026-06-02.",Increased upload size limit for account plan. Customer confirmed large files uploading correctly.,15,Payment API,Amazon,Arabic,UK,Critical,technical,Software bug or infrastructure issue,"Restart service, collect logs, investigate server health, deploy hotfix if required.",5.0,"Customer: Since the v3.2.2 update, our Zapier integration no longer syncs data. Last successful sync: 2026-06-02.
Support: Increased upload size limit for account plan. Customer confirmed large files uploading correctly."
TK-000326,2026-02-09 15:19:15,2026-02-10 21:19:15,email,AGT-020,product,low,closed,Difference between Pro and Business plans,Do you have a video tutorial or step-by-step guide for setting up bulk export?,Docs team notified. Updated documentation sent directly to customer.,14,Mobile App,Amazon,English,Saudi Arabia,Major,product,Missing documentation,Provide product documentation and user guide.,4.0,"Customer: Do you have a video tutorial or step-by-step guide for setting up bulk export?
Support: Docs team notified. Updated documentation sent directly to customer."
TK-000457,2026-01-09 07:07:47,2026-01-11 09:07:47,social_media,AGT-017,product,low,resolved,Feature request: dark mode,The custom reports works but could be much better if you added keyboard shortcuts.,Provided step-by-step guide for mobile notifications and shared link to updated documentation.,14,Desktop Client,Oracle,English,Germany,Major,product,Missing documentation,Provide product documentation and user guide.,4.0,"Customer: The custom reports works but could be much better if you added keyboard shortcuts.
Support: Provided step-by-step guide for mobile notifications and shared link to updated documentation."
TK-000907,2026-05-01 22:47:33,2026-05-02 17:47:33,phone_callback,AGT-003,shipping,high,resolved,Missing item from multi-item order,My order #66071 should have contained 4 items but only 1 arrived. Missing: Expanded fresh-thinking framework.,Investigated: address was cached from previous order. Refund issued; reshipment to correct address.,16,Payment API,Dell,Arabic,UAE,Critical,shipping,Courier delay,"Track shipment, contact courier, arrange replacement if necessary.",3.0,"Customer: My order #66071 should have contained 4 items but only 1 arrived. Missing: Expanded fresh-thinking framework.
Support: Investigated: address was cached from previous order. Refund issued; reshipment to correct address."
TK-000246,2026-03-02 19:52:35,2026-03-03 22:52:35,chat,AGT-005,shipping,high,closed,Package arrived damaged,My order #80902 should have contained 3 items but only 2 arrived. Missing: Organic zero-defect flexibility.,Missing item located in warehouse. Shipped separately with tracking. Customer confirmed receipt.,16,Mobile App,Cisco,English,Germany,Major,shipping,Courier delay,"Track shipment, contact courier, arrange replacement if necessary.",4.0,"Customer: My order #80902 should have contained 3 items but only 2 arrived. Missing: Organic zero-defect flexibility.
Support: Missing item located in warehouse. Shipped separately with tracking. Customer confirmed receipt."
TK-000114,2026-05-21 08:39:13,2026-05-21 20:39:13,phone_callback,AGT-005,billing,medium,resolved,Discount code not applied to my bill,I cancelled my subscription on 2026-06-20 but was still charged $164.76 for the next cycle.,Located the refund request. Escalated to finance team. ETA updated and customer informed.,15,CRM System,Google,English,Saudi Arabia,Major,billing,Incorrect billing configuration,"Verify invoice, compare billing history, process refund if needed.",3.0,"Customer: I cancelled my subscription on 2026-06-20 but was still charged $164.76 for the next cycle.
Support: Located the refund request. Escalated to finance team. ETA updated and customer informed."
TK-000567,2026-03-31 01:56:39,,chat,AGT-017,billing,medium,open,Incorrect charge on my invoice,I requested a refund 6 days ago (ticket ref TK-452591) but have not received it yet. Please expedite.,,18,Web Platform,Microsoft,English,Egypt,Major,billing,Incorrect billing configuration,"Verify invoice, compare billing history, process refund if needed.",,"Customer: I requested a refund 6 days ago (ticket ref TK-452591) but have not received it yet. Please expedite.
Support: Issue is under investigation."
TK-000202,2026-03-06 14:30:22,2026-03-07 08:30:22,web_form,AGT-017,general,medium,resolved,Looking for a case study or demo,"Can you share a case study for a company similar to ours, or arrange a product demo?",Forwarded to partnerships team. Partner program brochure sent.,17,Cloud Dashboard,Google,Arabic,USA,Critical,general,Customer information request,Answer customer inquiry using the official knowledge base.,4.0,"Customer: Can you share a case study for a company similar to ours, or arrange a product demo?
Support: Forwarded to partnerships team. Partner program brochure sent."
TK-000971,2026-02-21 10:38:07,,chat,AGT-018,technical,high,open,Login page returns 500 error,Uploads above 22MB fail with a timeout error. We regularly upload large datasets.,,13,Web Platform,Intel,English,USA,Minor,technical,Software bug or infrastructure issue,"Restart service, collect logs, investigate server health, deploy hotfix if required.",,"Customer: Uploads above 22MB fail with a timeout error. We regularly upload large datasets.
Support: Issue is under investigation."
TK-000770,2026-05-29 02:09:05,2026-05-29 19:09:05,social_media,AGT-019,general,high,closed,Looking for a partner/reseller program,We are a company in the EU. Can you confirm your data storage and processing is GDPR compliant?,Scheduled 30-minute demo. Sent relevant case study PDF post-call.,18,Web Platform,Amazon,English,USA,Major,general,Customer information request,Answer customer inquiry using the official knowledge base.,4.0,"Customer: We are a company in the EU. Can you confirm your data storage and processing is GDPR compliant?
Support: Scheduled 30-minute demo. Sent relevant case study PDF post-call."
TK-000722,2026-01-22 03:59:37,,email,AGT-006,general,low,in_progress,General inquiry about your service,"Can you share a case study for a company similar to ours, or arrange a product demo?",,17,CRM System,Intel,English,Egypt,Minor,general,Customer information request,Answer customer inquiry using the official knowledge base.,,"Customer: Can you share a case study for a company similar to ours, or arrange a product demo?
Support: Issue is under investigation."
TK-000833,2026-01-12 19:06:35,2026-01-13 01:06:35,chat,AGT-007,account,medium,resolved,Cannot reset my password,The password reset email is not arriving at stephenwilliams@example.org. I have checked spam. Please help me reset manually.,Found invite in spam filter configuration list. Whitelisted domain. Resent invite successfully.,18,Web Platform,Microsoft,English,Egypt,Minor,account,Authentication failure,"Verify customer identity, reset credentials, unlock account.",3.0,"Customer: The password reset email is not arriving at stephenwilliams@example.org. I have checked spam. Please help me reset manually.
Support: Found invite in spam filter configuration list. Whitelisted domain. Resent invite successfully."
TK-000792,2026-04-01 02:16:54,2026-04-03 13:16:54,email,AGT-015,account,medium,resolved,Team member invite not received,I sent a team invite to robert32@example.net 16 days ago but they say they never received it.,Found invite in spam filter configuration list. Whitelisted domain. Resent invite successfully.,17,Desktop Client,Amazon,Arabic,USA,Critical,account,Authentication failure,"Verify customer identity, reset credentials, unlock account.",5.0,"Customer: I sent a team invite to robert32@example.net 16 days ago but they say they never received it.
Support: Found invite in spam filter configuration list. Whitelisted domain. Resent invite successfully."
TK-000123,2026-05-19 07:43:02,,social_media,AGT-015,product,medium,in_progress,Compatibility question about Zapier,The docs for SSO login are outdated – the screenshots don't match the current UI.,,15,Mobile App,Google,English,USA,Minor,product,Missing documentation,Provide product documentation and user guide.,,"Customer: The docs for SSO login are outdated – the screenshots don't match the current UI.
Support: Issue is under investigation."
TK-000405,2026-01-06 03:05:16,2026-01-07 23:05:16,web_form,AGT-018,product,high,closed,Suggestion to improve bulk export,I can't figure out how to use dark mode. The documentation doesn't explain the steps clearly.,Confirmed compatibility. Shared integration guide and API credentials needed.,16,Desktop Client,Google,English,Egypt,Minor,product,Missing documentation,Provide product documentation and user guide.,4.0,"Customer: I can't figure out how to use dark mode. The documentation doesn't explain the steps clearly.
Support: Confirmed compatibility. Shared integration guide and API credentials needed."
TK-000949,2026-02-16 09:24:09,2026-02-17 18:24:09,phone_callback,AGT-008,general,medium,resolved,General inquiry about your service,What are your customer support hours and response time commitments?,Escalated to enterprise sales team. Custom proposal sent within 24 hours.,10,Desktop Client,Cisco,English,UAE,Major,general,Customer information request,Answer customer inquiry using the official knowledge base.,4.0,"Customer: What are your customer support hours and response time commitments?
Support: Escalated to enterprise sales team. Custom proposal sent within 24 hours."
TK-000756,2026-02-03 01:46:13,,social_media,AGT-019,shipping,medium,open,Package arrived damaged,My package arrived with significant damage. Contents are broken. Order #61028. Photos attached.,,13,Cloud Dashboard,Google,English,UK,Minor,shipping,Courier delay,"Track shipment, contact courier, arrange replacement if necessary.",,"Customer: My package arrived with significant damage. Contents are broken. Order #61028. Photos attached.
Support: Issue is under investigation."
TK-000999,2026-02-18 21:00:57,2026-02-19 12:00:57,web_form,AGT-003,general,low,resolved,What are your business hours?,What are your customer support hours and response time commitments?,Scheduled 30-minute demo. Sent relevant case study PDF post-call.,10,Desktop Client,IBM,English,Germany,Minor,general,Customer information request,Answer customer inquiry using the official knowledge base.,4.0,"Customer: What are your customer support hours and response time commitments?
Support: Scheduled 30-minute demo. Sent relevant case study PDF post-call."
TK-000181,2026-05-11 03:48:49,2026-05-11 18:48:49,web_form,AGT-015,product,high,resolved,Product documentation is unclear for dark mode,I can access bulk export on the web but it doesn't seem to exist in the mobile app. Any plans to add it?,Provided step-by-step guide for dark mode and shared link to updated documentation.,23,CRM System,Intel,English,UK,Critical,product,Missing documentation,Provide product documentation and user guide.,4.0,"Customer: I can access bulk export on the web but it doesn't seem to exist in the mobile app. Any plans to add it?
Support: Provided step-by-step guide for dark mode and shared link to updated documentation."
TK-000130,2026-03-15 20:12:12,2026-03-17 20:12:12,social_media,AGT-001,product,low,resolved,Product documentation is unclear for audit logs,The docs for custom reports are outdated – the screenshots don't match the current UI.,Enhancement suggestion logged for next sprint review. Customer thanked for feedback.,15,Cloud Dashboard,Intel,English,USA,Major,product,Missing documentation,Provide product documentation and user guide.,5.0,"Customer: The docs for custom reports are outdated – the screenshots don't match the current UI.
Support: Enhancement suggestion logged for next sprint review. Customer thanked for feedback."
TK-000197,2026-06-01 22:37:46,2026-06-02 02:37:46,social_media,AGT-009,shipping,high,resolved,Order shipped to wrong address,My order #16198 should have contained 6 items but only 4 arrived. Missing: Expanded solution-oriented benchmark.,Address updated in system before dispatch. Customer confirmed new address is correct.,16,Cloud Dashboard,Cisco,Arabic,UAE,Critical,shipping,Courier delay,"Track shipment, contact courier, arrange replacement if necessary.",3.0,"Customer: My order #16198 should have contained 6 items but only 4 arrived. Missing: Expanded solution-oriented benchmark.
Support: Address updated in system before dispatch. Customer confirmed new address is correct."
TK-000538,2026-04-05 10:46:48,2026-04-06 04:46:48,phone_callback,AGT-018,shipping,high,resolved,Request to change delivery address,My order #80393 should have contained 6 items but only 3 arrived. Missing: Balanced interactive open system.,Damage claim filed with carrier. Replacement order created and shipped. Photo evidence retained.,17,Payment API,Intel,Arabic,USA,Major,shipping,Courier delay,"Track shipment, contact courier, arrange replacement if necessary.",3.0,"Customer: My order #80393 should have contained 6 items but only 3 arrived. Missing: Balanced interactive open system.
Support: Damage claim filed with carrier. Replacement order created and shipped. Photo evidence retained."
TK-000169,2026-03-05 20:21:59,2026-03-08 10:21:59,email,AGT-009,technical,medium,closed,File upload fails for files over 28MB,I get a 500 Internal Server Error when trying to log in. This started 26 days ago. Browser: Firefox 115.,Found misconfiguration in rate-limit tier for this account. Corrected and documented.,20,Cloud Dashboard,Cisco,Arabic,Germany,Major,technical,Software bug or infrastructure issue,"Restart service, collect logs, investigate server health, deploy hotfix if required.",4.0,"Customer: I get a 500 Internal Server Error when trying to log in. This started 26 days ago. Browser: Firefox 115.
Support: Found misconfiguration in rate-limit tier for this account. Corrected and documented."
TK-000555,2026-01-10 22:19:39,,social_media,AGT-012,product,low,in_progress,Product documentation is unclear for bulk export,I'm trying to decide between Pro and Teams. What are the key differences for a team of 57712 people?,,19,Mobile App,Microsoft,English,Egypt,Critical,product,Missing documentation,Provide product documentation and user guide.,,"Customer: I'm trying to decide between Pro and Teams. What are the key differences for a team of 57712 people?
Support: Issue is under investigation."
TK-000278,2025-12-31 16:31:21,,phone_callback,AGT-012,shipping,medium,open,Request to change delivery address,My order #76028 should have contained 5 items but only 1 arrived. Missing: Balanced executive neural-net.,,16,Mobile App,IBM,Arabic,Saudi Arabia,Major,shipping,Courier delay,"Track shipment, contact courier, arrange replacement if necessary.",,"Customer: My order #76028 should have contained 5 items but only 1 arrived. Missing: Balanced executive neural-net.
Support: Issue is under investigation."
TK-000947,2026-01-17 16:30:32,,email,AGT-014,general,low,escalated,General inquiry about your service,We are a company in the EU. Can you confirm your data storage and processing is GDPR compliant?,,18,Desktop Client,Oracle,English,UK,Minor,general,Customer information request,Answer customer inquiry using the official knowledge base.,,"Customer: We are a company in the EU. Can you confirm your data storage and processing is GDPR compliant?
Support: Issue is under investigation."
TK-000598,2026-04-05 19:44:27,2026-04-07 02:44:27,chat,AGT-011,technical,medium,resolved,Data export feature not working,The app crashes every time I open it since the update on 2026-06-01. I am on macOS 14 version 4.9.3. Error log: ERR-hqhP-6348.,Fixed CSV export encoding issue in backend. Customer re-ran export successfully.,23,Web Platform,Microsoft,Arabic,UAE,Critical,technical,Software bug or infrastructure issue,"Restart service, collect logs, investigate server health, deploy hotfix if required.",5.0,"Customer: The app crashes every time I open it since the update on 2026-06-01. I am on macOS 14 version 4.9.3. Error log: ERR-hqhP-6348.
Support: Fixed CSV export encoding issue in backend. Customer re-ran export successfully."
TK-000220,2026-02-22 04:32:38,,phone_callback,AGT-007,technical,medium,escalated,Login page returns 500 error,The dashboard takes over 33 seconds to load. This is affecting our team's productivity.,,14,Payment API,Dell,English,Germany,Critical,technical,Software bug or infrastructure issue,"Restart service, collect logs, investigate server health, deploy hotfix if required.",,"Customer: The dashboard takes over 33 seconds to load. This is affecting our team's productivity.
Support: Issue is under investigation."
TK-000529,2026-01-23 09:23:56,,social_media,AGT-002,billing,high,escalated,Cannot access invoice #90949,I upgraded my plan but the old price is still showing on invoice #55775. The new rate should be $51.66/month.,,20,CRM System,Dell,Arabic,UAE,Critical,billing,Incorrect billing configuration,"Verify invoice, compare billing history, process refund if needed.",,"Customer: I upgraded my plan but the old price is still showing on invoice #55775. The new rate should be $51.66/month.
Support: Issue is under investigation."
