ticket_id,created_at,resolved_at,channel,agent_id,category,priority,status,subject,body,resolution_note,word_count,product,company,language,region,severity,tags,root_cause,knowledge_article,customer_satisfaction,conversation
TK-000583,2026-03-19 02:34:51,2026-03-20 21:34:51,chat,AGT-009,product,low,closed,How do I use mobile notifications?,The docs for mobile notifications are outdated – the screenshots don't match the current UI.,Confirmed dark mode is on the mobile roadmap for Q4. Customer added to beta list.,15,Payment API,Cisco,English,USA,Minor,product,Missing documentation,Provide product documentation and user guide.,4.0,"Customer: The docs for mobile notifications are outdated – the screenshots don't match the current UI.
Support: Confirmed dark mode is on the mobile roadmap for Q4. Customer added to beta list."
TK-000487,2026-05-06 17:16:22,,chat,AGT-009,account,medium,in_progress,Need to update email address on file,I uploaded a new profile photo but the old one keeps showing even after clearing cache.,,16,CRM System,Intel,English,Saudi Arabia,Minor,account,Authentication failure,"Verify customer identity, reset credentials, unlock account.",,"Customer: I uploaded a new profile photo but the old one keeps showing even after clearing cache.
Support: Issue is under investigation."
TK-000704,2026-04-09 09:35:31,2026-04-12 05:35:31,chat,AGT-017,billing,high,resolved,Incorrect charge on my invoice,I was charged $210.28 on 2026-05-31 but this does not match my plan. My account email is marymitchell@example.org. Please review and correct.,Confirmed duplicate charge. Refund of $230.39 initiated and will reflect in 3–5 business days.,22,CRM System,Intel,English,USA,Minor,billing,Incorrect billing configuration,"Verify invoice, compare billing history, process refund if needed.",4.0,"Customer: I was charged $210.28 on 2026-05-31 but this does not match my plan. My account email is marymitchell@example.org. Please review and correct.
Support: Confirmed duplicate charge. Refund of $230.39 initiated and will reflect in 3–5 business days."
TK-000321,2026-06-08 18:13:42,,web_form,AGT-004,product,low,escalated,Suggestion to improve bulk export,The docs for dark mode are outdated – the screenshots don't match the current UI.,,15,Cloud Dashboard,Google,English,Germany,Critical,product,Missing documentation,Provide product documentation and user guide.,,"Customer: The docs for dark mode are outdated – the screenshots don't match the current UI.
Support: Issue is under investigation."
TK-000096,2026-06-25 01:01:09,2026-06-26 13:01:09,web_form,AGT-001,technical,high,closed,API rate limit exceeded unexpectedly,Uploads above 47MB fail with a timeout error. We regularly upload large datasets.,Increased upload size limit for account plan. Customer confirmed large files uploading correctly.,13,Desktop Client,Amazon,English,UAE,Minor,technical,Software bug or infrastructure issue,"Restart service, collect logs, investigate server health, deploy hotfix if required.",5.0,"Customer: Uploads above 47MB fail with a timeout error. We regularly upload large datasets.
Support: Increased upload size limit for account plan. Customer confirmed large files uploading correctly."
TK-001000,2026-02-27 11:01:20,,web_form,AGT-005,product,low,open,Is custom reports available on the mobile app?,I'm trying to decide between Basic and Enterprise. What are the key differences for a team of 28594 people?,,19,Mobile App,Microsoft,English,Germany,Critical,product,Missing documentation,Provide product documentation and user guide.,,"Customer: I'm trying to decide between Basic and Enterprise. What are the key differences for a team of 28594 people?
Support: Issue is under investigation."
TK-000265,2026-05-05 18:01:28,2026-05-07 13:01:28,social_media,AGT-005,product,low,resolved,Difference between Starter and Teams plans,The bulk export works but could be much better if you added batch actions.,Shared tutorial video and written guide. Customer confirmed issue resolved.,14,Desktop Client,Amazon,English,USA,Critical,product,Missing documentation,Provide product documentation and user guide.,3.0,"Customer: The bulk export works but could be much better if you added batch actions.
Support: Shared tutorial video and written guide. Customer confirmed issue resolved."
TK-000997,2026-02-23 11:52:37,2026-02-24 14:52:37,chat,AGT-001,technical,medium,resolved,Login page returns 500 error,"Since the v1.6.14 update, our Salesforce integration no longer syncs data. Last successful sync: 2026-05-20.",Fixed CSV export encoding issue in backend. Customer re-ran export successfully.,15,Web Platform,Oracle,Arabic,UAE,Major,technical,Software bug or infrastructure issue,"Restart service, collect logs, investigate server health, deploy hotfix if required.",5.0,"Customer: Since the v1.6.14 update, our Salesforce integration no longer syncs data. Last successful sync: 2026-05-20.
Support: Fixed CSV export encoding issue in backend. Customer re-ran export successfully."
TK-000811,2026-05-17 00:47:58,2026-05-18 21:47:58,social_media,AGT-003,account,medium,resolved,Need to update email address on file,I need to change my account email from ashley93@example.com to a new address. Please advise the process.,Photo CDN cache cleared for account. Customer confirmed new photo is visible.,17,Cloud Dashboard,IBM,English,Germany,Critical,account,Authentication failure,"Verify customer identity, reset credentials, unlock account.",4.0,"Customer: I need to change my account email from ashley93@example.com to a new address. Please advise the process.
Support: Photo CDN cache cleared for account. Customer confirmed new photo is visible."
TK-000465,2026-06-24 20:31:46,,chat,AGT-020,account,low,open,Cannot delete my account,I uploaded a new profile photo but the old one keeps showing even after clearing cache.,,16,Payment API,Microsoft,Arabic,UK,Minor,account,Authentication failure,"Verify customer identity, reset credentials, unlock account.",,"Customer: I uploaded a new profile photo but the old one keeps showing even after clearing cache.
Support: Issue is under investigation."
TK-000663,2026-03-13 18:05:16,2026-03-15 12:05:16,phone_callback,AGT-010,general,low,resolved,General inquiry about your service,I came across your service online and want to know more about what you offer before signing up.,Shared SLA document outlining support hours and response time commitments by plan tier.,18,Web Platform,Amazon,English,USA,Major,general,Customer information request,Answer customer inquiry using the official knowledge base.,4.0,"Customer: I came across your service online and want to know more about what you offer before signing up.
Support: Shared SLA document outlining support hours and response time commitments by plan tier."
TK-000741,2026-03-19 00:35:02,,social_media,AGT-003,shipping,medium,open,Order shipped to wrong address,"I need to change the delivery address for order #54006 before it ships. New address: 30206 Lauren Bridge, Jasonhaven, LA 44644.",,21,Cloud Dashboard,Amazon,Arabic,UAE,Major,shipping,Courier delay,"Track shipment, contact courier, arrange replacement if necessary.",,"Customer: I need to change the delivery address for order #54006 before it ships. New address: 30206 Lauren Bridge, Jasonhaven, LA 44644.
Support: Issue is under investigation."
TK-000927,2026-02-10 23:47:15,,phone_callback,AGT-006,account,medium,open,Account locked after too many login attempts,I want to close my account permanently but the delete option is greyed out in settings.,,16,Mobile App,IBM,Arabic,USA,Major,account,Authentication failure,"Verify customer identity, reset credentials, unlock account.",,"Customer: I want to close my account permanently but the delete option is greyed out in settings.
Support: Issue is under investigation."
TK-000133,2026-05-20 09:50:52,2026-05-22 20:50:52,web_form,AGT-003,general,low,resolved,General inquiry about your service,We are interested in reselling your product. Do you have a partner programme?,Sent DPA and GDPR compliance documentation. Offered to connect with our DPO.,13,Web Platform,Microsoft,Arabic,UAE,Minor,general,Customer information request,Answer customer inquiry using the official knowledge base.,5.0,"Customer: We are interested in reselling your product. Do you have a partner programme?
Support: Sent DPA and GDPR compliance documentation. Offered to connect with our DPO."
TK-000092,2026-04-16 12:35:05,2026-04-19 11:35:05,web_form,AGT-003,shipping,high,resolved,Return shipment not picked up,My order #62733 should have contained 6 items but only 4 arrived. Missing: Pre-emptive bandwidth-monitored moderator.,Tracking system glitch identified. Actual package in transit. Customer updated with real ETA.,16,Payment API,Cisco,English,UK,Major,shipping,Courier delay,"Track shipment, contact courier, arrange replacement if necessary.",5.0,"Customer: My order #62733 should have contained 6 items but only 4 arrived. Missing: Pre-emptive bandwidth-monitored moderator.
Support: Tracking system glitch identified. Actual package in transit. Customer updated with real ETA."
TK-000087,2026-05-17 02:21:12,2026-05-17 12:21:12,phone_callback,AGT-009,general,high,resolved,Is my data GDPR compliant?,We are a company in the EU. Can you confirm your data storage and processing is GDPR compliant?,Provided product overview and feature sheet. Offered to schedule a demo call.,18,Web Platform,Dell,English,Egypt,Minor,general,Customer information request,Answer customer inquiry using the official knowledge base.,3.0,"Customer: We are a company in the EU. Can you confirm your data storage and processing is GDPR compliant?
Support: Provided product overview and feature sheet. Offered to schedule a demo call."
TK-000919,2026-02-21 11:13:39,2026-02-23 13:13:39,chat,AGT-004,shipping,low,resolved,Tracking number not updating,My order #60887 was supposed to arrive 16 days ago but I still haven't received it. Tracking: TK-365477.,Tracking system glitch identified. Actual package in transit. Customer updated with real ETA.,18,Cloud Dashboard,IBM,Arabic,UK,Critical,shipping,Courier delay,"Track shipment, contact courier, arrange replacement if necessary.",5.0,"Customer: My order #60887 was supposed to arrive 16 days ago but I still haven't received it. Tracking: TK-365477.
Support: Tracking system glitch identified. Actual package in transit. Customer updated with real ETA."
TK-000079,2026-03-10 09:42:42,2026-03-12 14:42:42,email,AGT-017,technical,medium,resolved,File upload fails for files over 25MB,"Since the v3.4.2 update, our Shopify integration no longer syncs data. Last successful sync: 2026-05-25.",Integration token expired silently after update. Guided customer to re-authenticate. Sync restored.,15,CRM System,Dell,Arabic,USA,Critical,technical,Software bug or infrastructure issue,"Restart service, collect logs, investigate server health, deploy hotfix if required.",3.0,"Customer: Since the v3.4.2 update, our Shopify integration no longer syncs data. Last successful sync: 2026-05-25.
Support: Integration token expired silently after update. Guided customer to re-authenticate. Sync restored."
TK-000277,2026-01-27 06:28:19,2026-01-30 03:28:19,web_form,AGT-004,billing,medium,closed,Cannot access invoice #68278,I requested a refund 3 days ago (ticket ref TK-153030) but have not received it yet. Please expedite.,Confirmed duplicate charge. Refund of $344.19 initiated and will reflect in 3–5 business days.,18,Mobile App,Intel,English,USA,Major,billing,Incorrect billing configuration,"Verify invoice, compare billing history, process refund if needed.",5.0,"Customer: I requested a refund 3 days ago (ticket ref TK-153030) but have not received it yet. Please expedite.
Support: Confirmed duplicate charge. Refund of $344.19 initiated and will reflect in 3–5 business days."
TK-000774,2026-01-16 11:31:11,2026-01-17 14:31:11,chat,AGT-008,shipping,high,resolved,Received wrong item in my order,My package arrived with significant damage. Contents are broken. Order #86503. Photos attached.,Missing item located in warehouse. Shipped separately with tracking. Customer confirmed receipt.,13,Mobile App,Intel,English,UK,Critical,shipping,Courier delay,"Track shipment, contact courier, arrange replacement if necessary.",5.0,"Customer: My package arrived with significant damage. Contents are broken. Order #86503. Photos attached.
Support: Missing item located in warehouse. Shipped separately with tracking. Customer confirmed receipt."
TK-000683,2026-06-20 23:43:36,2026-06-21 21:43:36,social_media,AGT-014,billing,medium,resolved,Billing address update not reflected,I cancelled my subscription on 2026-05-20 but was still charged $20.5 for the next cycle.,Updated invoice to reflect correct pricing. Sent amended invoice to customer.,15,Mobile App,Microsoft,English,Germany,Minor,billing,Incorrect billing configuration,"Verify invoice, compare billing history, process refund if needed.",5.0,"Customer: I cancelled my subscription on 2026-05-20 but was still charged $20.5 for the next cycle.
Support: Updated invoice to reflect correct pricing. Sent amended invoice to customer."
TK-000586,2026-04-29 01:17:48,2026-04-30 09:17:48,email,AGT-014,technical,high,closed,Data export feature not working,I get a 500 Internal Server Error when trying to log in. This started 19 days ago. Browser: Chrome 124.,Identified a bug in v4.8.10 causing crashes on macOS 14. Hotfix deployed. Customer asked to update.,20,Mobile App,IBM,Arabic,Germany,Major,technical,Software bug or infrastructure issue,"Restart service, collect logs, investigate server health, deploy hotfix if required.",5.0,"Customer: I get a 500 Internal Server Error when trying to log in. This started 19 days ago. Browser: Chrome 124.
Support: Identified a bug in v4.8.10 causing crashes on macOS 14. Hotfix deployed. Customer asked to update."
TK-000275,2026-01-11 22:39:13,,chat,AGT-008,billing,medium,open,Double billing issue,I cancelled my subscription on 2026-05-05 but was still charged $201.42 for the next cycle.,,15,Payment API,Amazon,English,Germany,Major,billing,Incorrect billing configuration,"Verify invoice, compare billing history, process refund if needed.",,"Customer: I cancelled my subscription on 2026-05-05 but was still charged $201.42 for the next cycle.
Support: Issue is under investigation."
TK-000760,2026-01-18 22:44:55,2026-01-21 14:44:55,chat,AGT-013,technical,high,closed,File upload fails for files over 88MB,Our API key is hitting rate limits even though we are well within the documented quota. Account ID: 3673.,Integration token expired silently after update. Guided customer to re-authenticate. Sync restored.,19,Payment API,Microsoft,English,Saudi Arabia,Critical,technical,Software bug or infrastructure issue,"Restart service, collect logs, investigate server health, deploy hotfix if required.",4.0,"Customer: Our API key is hitting rate limits even though we are well within the documented quota. Account ID: 3673.
Support: Integration token expired silently after update. Guided customer to re-authenticate. Sync restored."
TK-000711,2026-02-08 01:01:39,2026-02-10 18:01:39,web_form,AGT-006,shipping,high,closed,Tracking number not updating,"I need to change the delivery address for order #45006 before it ships. New address: 3457 Andrew Cove, Huntchester, MI 42929.",Tracking system glitch identified. Actual package in transit. Customer updated with real ETA.,21,Web Platform,Intel,Arabic,Saudi Arabia,Minor,shipping,Courier delay,"Track shipment, contact courier, arrange replacement if necessary.",5.0,"Customer: I need to change the delivery address for order #45006 before it ships. New address: 3457 Andrew Cove, Huntchester, MI 42929.
Support: Tracking system glitch identified. Actual package in transit. Customer updated with real ETA."
TK-000208,2026-01-24 23:59:37,2026-01-26 04:59:37,social_media,AGT-011,billing,medium,resolved,Tax exemption certificate not processed,I cancelled my subscription on 2026-06-08 but was still charged $55.14 for the next cycle.,Located the refund request. Escalated to finance team. ETA updated and customer informed.,15,Desktop Client,Oracle,English,Saudi Arabia,Major,billing,Incorrect billing configuration,"Verify invoice, compare billing history, process refund if needed.",5.0,"Customer: I cancelled my subscription on 2026-06-08 but was still charged $55.14 for the next cycle.
Support: Located the refund request. Escalated to finance team. ETA updated and customer informed."
TK-000878,2026-02-04 21:39:20,2026-02-07 13:39:20,social_media,AGT-012,general,low,resolved,Accessibility features available?,"Can you share a case study for a company similar to ours, or arrange a product demo?",Scheduled 30-minute demo. Sent relevant case study PDF post-call.,17,Web Platform,Oracle,Arabic,UK,Critical,general,Customer information request,Answer customer inquiry using the official knowledge base.,4.0,"Customer: Can you share a case study for a company similar to ours, or arrange a product demo?
Support: Scheduled 30-minute demo. Sent relevant case study PDF post-call."
TK-000571,2026-06-24 06:30:06,,web_form,AGT-017,shipping,medium,escalated,Missing item from multi-item order,My package arrived with significant damage. Contents are broken. Order #81643. Photos attached.,,13,Mobile App,Dell,Arabic,UAE,Major,shipping,Courier delay,"Track shipment, contact courier, arrange replacement if necessary.",,"Customer: My package arrived with significant damage. Contents are broken. Order #81643. Photos attached.
Support: Issue is under investigation."
TK-000674,2026-04-13 13:41:00,,web_form,AGT-009,technical,high,escalated,Application crashes on startup,The dashboard takes over 30 seconds to load. This is affecting our team's productivity.,,14,CRM System,Cisco,English,Egypt,Critical,technical,Software bug or infrastructure issue,"Restart service, collect logs, investigate server health, deploy hotfix if required.",,"Customer: The dashboard takes over 30 seconds to load. This is affecting our team's productivity.
Support: Issue is under investigation."
TK-000170,2026-04-02 03:20:45,,email,AGT-007,billing,medium,open,Incorrect charge on my invoice,I updated my billing address last week but my latest invoice still shows the old address.,,16,Cloud Dashboard,Amazon,English,Germany,Minor,billing,Incorrect billing configuration,"Verify invoice, compare billing history, process refund if needed.",,"Customer: I updated my billing address last week but my latest invoice still shows the old address.
Support: Issue is under investigation."
TK-000028,2026-03-09 21:45:49,,chat,AGT-006,billing,high,in_progress,Unexpected subscription renewal charge,My account shows two identical charges of $248.46 on the same date. I need a refund for the duplicate.,,19,Payment API,Cisco,English,USA,Minor,billing,Incorrect billing configuration,"Verify invoice, compare billing history, process refund if needed.",,"Customer: My account shows two identical charges of $248.46 on the same date. I need a refund for the duplicate.
Support: Issue is under investigation."
TK-000084,2026-02-21 01:54:10,2026-02-22 08:54:10,social_media,AGT-009,general,medium,resolved,Is my data GDPR compliant?,What are your customer support hours and response time commitments?,Scheduled 30-minute demo. Sent relevant case study PDF post-call.,10,Cloud Dashboard,Oracle,English,UK,Critical,general,Customer information request,Answer customer inquiry using the official knowledge base.,5.0,"Customer: What are your customer support hours and response time commitments?
Support: Scheduled 30-minute demo. Sent relevant case study PDF post-call."
TK-000126,2026-06-14 05:08:32,,email,AGT-007,technical,high,open,API rate limit exceeded unexpectedly,"Since the v3.2.3 update, our Zapier integration no longer syncs data. Last successful sync: 2026-05-16.",,15,Cloud Dashboard,Dell,Arabic,Egypt,Critical,technical,Software bug or infrastructure issue,"Restart service, collect logs, investigate server health, deploy hotfix if required.",,"Customer: Since the v3.2.3 update, our Zapier integration no longer syncs data. Last successful sync: 2026-05-16.
Support: Issue is under investigation."
TK-000011,2026-05-03 12:34:21,2026-05-04 00:34:21,email,AGT-010,technical,high,resolved,Integration with Slack broken after update,The dashboard takes over 32 seconds to load. This is affecting our team's productivity.,Identified slow query in dashboard aggregation. Added index. Load time reduced to under 2s.,14,Mobile App,Google,English,UAE,Critical,technical,Software bug or infrastructure issue,"Restart service, collect logs, investigate server health, deploy hotfix if required.",5.0,"Customer: The dashboard takes over 32 seconds to load. This is affecting our team's productivity.
Support: Identified slow query in dashboard aggregation. Added index. Load time reduced to under 2s."
TK-000090,2026-02-01 09:51:38,,web_form,AGT-003,billing,medium,open,Incorrect charge on my invoice,I was charged $404.17 on 2026-06-14 but this does not match my plan. My account email is roberto75@example.com. Please review and correct.,,22,Cloud Dashboard,Oracle,English,Egypt,Major,billing,Incorrect billing configuration,"Verify invoice, compare billing history, process refund if needed.",,"Customer: I was charged $404.17 on 2026-06-14 but this does not match my plan. My account email is roberto75@example.com. Please review and correct.
Support: Issue is under investigation."
TK-000333,2026-01-29 06:20:56,2026-01-29 15:20:56,web_form,AGT-005,product,low,resolved,Product documentation is unclear for SSO login,I can't figure out how to use API webhooks. The documentation doesn't explain the steps clearly.,Confirmed dark mode is on the mobile roadmap for Q3. Customer added to beta list.,16,Cloud Dashboard,Oracle,English,UK,Minor,product,Missing documentation,Provide product documentation and user guide.,3.0,"Customer: I can't figure out how to use API webhooks. The documentation doesn't explain the steps clearly.
Support: Confirmed dark mode is on the mobile roadmap for Q3. Customer added to beta list."
TK-000178,2026-06-11 23:09:09,,phone_callback,AGT-006,account,medium,in_progress,Cannot delete my account,I uploaded a new profile photo but the old one keeps showing even after clearing cache.,,16,Cloud Dashboard,Intel,English,USA,Critical,account,Authentication failure,"Verify customer identity, reset credentials, unlock account.",,"Customer: I uploaded a new profile photo but the old one keeps showing even after clearing cache.
Support: Issue is under investigation."
TK-000209,2026-02-22 04:34:13,2026-02-23 21:34:13,phone_callback,AGT-007,technical,high,closed,Data export feature not working,"Since the v2.6.8 update, our Slack integration no longer syncs data. Last successful sync: 2026-05-08.",Fixed CSV export encoding issue in backend. Customer re-ran export successfully.,15,Desktop Client,Google,English,USA,Major,technical,Software bug or infrastructure issue,"Restart service, collect logs, investigate server health, deploy hotfix if required.",4.0,"Customer: Since the v2.6.8 update, our Slack integration no longer syncs data. Last successful sync: 2026-05-08.
Support: Fixed CSV export encoding issue in backend. Customer re-ran export successfully."
TK-000280,2026-02-14 21:51:55,,social_media,AGT-006,shipping,high,in_progress,Missing item from multi-item order,My order #82741 should have contained 6 items but only 4 arrived. Missing: Front-line uniform access.,,16,Web Platform,Microsoft,English,UAE,Major,shipping,Courier delay,"Track shipment, contact courier, arrange replacement if necessary.",,"Customer: My order #82741 should have contained 6 items but only 4 arrived. Missing: Front-line uniform access.
Support: Issue is under investigation."
TK-000254,2026-05-25 12:24:31,2026-05-26 12:24:31,email,AGT-006,account,high,resolved,Profile photo not updating,I uploaded a new profile photo but the old one keeps showing even after clearing cache.,Account deletion restriction due to active subscription. Customer cancelled subscription; account deleted.,16,Mobile App,Microsoft,Arabic,Germany,Minor,account,Authentication failure,"Verify customer identity, reset credentials, unlock account.",4.0,"Customer: I uploaded a new profile photo but the old one keeps showing even after clearing cache.
Support: Account deletion restriction due to active subscription. Customer cancelled subscription; account deleted."
TK-000935,2026-05-25 00:42:20,,email,AGT-011,account,high,escalated,Team member invite not received,My account xschneider@example.net is locked after failed login attempts. I am the legitimate owner. Please unlock.,,16,Web Platform,Google,Arabic,USA,Minor,account,Authentication failure,"Verify customer identity, reset credentials, unlock account.",,"Customer: My account xschneider@example.net is locked after failed login attempts. I am the legitimate owner. Please unlock.
Support: Issue is under investigation."
TK-000980,2026-01-31 02:32:09,2026-01-31 16:32:09,chat,AGT-015,account,medium,resolved,Account locked after too many login attempts,My account brenda40@example.net is locked after failed login attempts. I am the legitimate owner. Please unlock.,Accounts merged successfully. Data audit performed. Customer notified.,16,Payment API,Amazon,English,Germany,Minor,account,Authentication failure,"Verify customer identity, reset credentials, unlock account.",3.0,"Customer: My account brenda40@example.net is locked after failed login attempts. I am the legitimate owner. Please unlock.
Support: Accounts merged successfully. Data audit performed. Customer notified."
